{
  "schemaVersion": 1,
  "generatedAt": "2026-10-31T07:20:01.789Z",
  "version": "3.3.3",
  "sourcePolicy": "private-complete-original-workspace",
  "openSourcePolicy": "public-open-source-main-repository",
  "sourceBaseline": {
    "repository": "https://git.flyfish.dev/flyfish-group/file-viewer.git",
    "branch": "main",
    "policy": "private-complete-original-workspace",
    "authoritativeCommit": "aee3f688b763a8a4a26739bd3d03604038a08f51",
    "localBranch": "main",
    "localCommit": "aee3f688b763a8a4a26739bd3d03604038a08f51",
    "inSync": true,
    "note": "Private Gitea main is the complete original aggregate workspace. The local checkout branch is only the execution context and can be transitional during branch cutover."
  },
  "local": {
    "branch": "main",
    "commit": "aee3f688b763a8a4a26739bd3d03604038a08f51",
    "shortCommit": "aee3f688b",
    "dirty": false
  },
  "sourceRemote": {
    "url": "https://git.flyfish.dev/flyfish-group/file-viewer.git",
    "branch": "main",
    "ok": true,
    "hash": "aee3f688b763a8a4a26739bd3d03604038a08f51",
    "error": ""
  },
  "openSourceMain": {
    "github": {
      "url": "https://github.com/flyfish-dev/file-viewer",
      "branch": "main",
      "ok": true,
      "hash": "1c1ff4261a4aa3bacf1bd65dc9f471d91bb4a458",
      "error": ""
    },
    "gitee": {
      "url": "https://gitee.com/flyfish-dev/file-viewer",
      "branch": "main",
      "ok": true,
      "hash": "955ff505dafa326ca84a5cc015abb7b99c7b9d97",
      "error": ""
    },
    "inSync": false,
    "syncMode": "unchecked",
    "treeChecked": false,
    "referenceTree": "11e73a65d13589e54733e24205811b574585442c",
    "giteeTree": "",
    "treeError": "local public repository 77fd41b331f3 does not match GitHub 1c1ff4261a4a",
    "reportHashNote": "The open-source main repository mirrors the current public source tree and records the private source commit in the public commit body for traceability. The observed remote hash can trail until that mirror commit is pushed. Gitee can intentionally use a shallow snapshot commit; inSync is true when the file tree matches even if commit hashes differ. Use pnpm audit:ecosystem-status for live remote heads."
  },
  "githubRelease": {
    "ok": false,
    "tag": "v3.3.3",
    "url": "",
    "assetCount": 0,
    "hasManifest": false,
    "hasStatus": false,
    "hasSchema": false,
    "error": "release not found"
  },
  "componentRepositories": [
    {
      "id": "core",
      "packageName": "@file-viewer/core",
      "github": {
        "url": "https://github.com/flyfish-dev/file-viewer-core",
        "branch": "main",
        "ok": true,
        "hash": "99762690b10d65c30dffa1587b94a1c46732367f",
        "error": ""
      },
      "gitee": {
        "url": "https://gitee.com/flyfish-dev/file-viewer-core",
        "branch": "main",
        "ok": false,
        "hash": "",
        "error": "remote: [session-id] 404 not found!\nfatal: repository 'https://gitee.com/flyfish-dev/file-viewer-core/' not found"
      }
    },
    {
      "id": "web",
      "packageName": "@file-viewer/web",
      "github": {
        "url": "https://github.com/flyfish-dev/file-viewer-web",
        "branch": "main",
        "ok": true,
        "hash": "4aadf67da683e872e6588a1151e22bfab0a125d1",
        "error": ""
      },
      "gitee": {
        "url": "https://gitee.com/flyfish-dev/file-viewer-web",
        "branch": "main",
        "ok": false,
        "hash": "",
        "error": "remote: [session-id] 404 not found!\nfatal: repository 'https://gitee.com/flyfish-dev/file-viewer-web/' not found"
      }
    },
    {
      "id": "web-full",
      "packageName": "@file-viewer/web-full",
      "github": {
        "url": "https://github.com/flyfish-dev/file-viewer-web-full",
        "branch": "main",
        "ok": true,
        "hash": "a13ae1b241683c83a25c01302506dced431683b5",
        "error": ""
      },
      "gitee": {
        "url": "https://gitee.com/flyfish-dev/file-viewer-web-full",
        "branch": "main",
        "ok": false,
        "hash": "",
        "error": "remote: [session-id] 404 not found!\nfatal: repository 'https://gitee.com/flyfish-dev/file-viewer-web-full/' not found"
      }
    },
    {
      "id": "vue3",
      "packageName": "@file-viewer/vue3",
      "github": {
        "url": "https://github.com/flyfish-dev/file-viewer-vue3",
        "branch": "main",
        "ok": true,
        "hash": "1da9e04428b0d9a2801e0d1ec2f9ff1def45c667",
        "error": ""
      },
      "gitee": {
        "url": "https://gitee.com/flyfish-dev/file-viewer-vue3",
        "branch": "main",
        "ok": false,
        "hash": "",
        "error": "remote: [session-id] 404 not found!\nfatal: repository 'https://gitee.com/flyfish-dev/file-viewer-vue3/' not found"
      }
    },
    {
      "id": "vue3-full",
      "packageName": "@file-viewer/vue3-full",
      "github": {
        "url": "https://github.com/flyfish-dev/file-viewer-vue3-full",
        "branch": "main",
        "ok": true,
        "hash": "237c790410686721854d8ce710ef0efad0075e17",
        "error": ""
      },
      "gitee": {
        "url": "https://gitee.com/flyfish-dev/file-viewer-vue3-full",
        "branch": "main",
        "ok": false,
        "hash": "",
        "error": "remote: [session-id] 404 not found!\nfatal: repository 'https://gitee.com/flyfish-dev/file-viewer-vue3-full/' not found"
      }
    },
    {
      "id": "vue2.7",
      "packageName": "@file-viewer/vue2.7",
      "github": {
        "url": "https://github.com/flyfish-dev/file-viewer-vue2.7",
        "branch": "main",
        "ok": true,
        "hash": "cf0d2891f3b9745390d0f979a49f2267ffc8eea9",
        "error": ""
      },
      "gitee": {
        "url": "https://gitee.com/flyfish-dev/file-viewer-vue2.7",
        "branch": "main",
        "ok": false,
        "hash": "",
        "error": "remote: [session-id] 404 not found!\nfatal: repository 'https://gitee.com/flyfish-dev/file-viewer-vue2.7/' not found"
      }
    },
    {
      "id": "vue2.7-full",
      "packageName": "@file-viewer/vue2.7-full",
      "github": {
        "url": "https://github.com/flyfish-dev/file-viewer-vue2.7-full",
        "branch": "main",
        "ok": true,
        "hash": "32bfa222744bd64f349d2ecb2d1fe1b34d6e4b26",
        "error": ""
      },
      "gitee": {
        "url": "https://gitee.com/flyfish-dev/file-viewer-vue2.7-full",
        "branch": "main",
        "ok": false,
        "hash": "",
        "error": "remote: [session-id] 404 not found!\nfatal: repository 'https://gitee.com/flyfish-dev/file-viewer-vue2.7-full/' not found"
      }
    },
    {
      "id": "vue2.6",
      "packageName": "@file-viewer/vue2.6",
      "github": {
        "url": "https://github.com/flyfish-dev/file-viewer-vue2.6",
        "branch": "main",
        "ok": true,
        "hash": "44e8017db07fc3e98751a6261a4b765ab439c609",
        "error": ""
      },
      "gitee": {
        "url": "https://gitee.com/flyfish-dev/file-viewer-vue2.6",
        "branch": "main",
        "ok": false,
        "hash": "",
        "error": "remote: [session-id] 404 not found!\nfatal: repository 'https://gitee.com/flyfish-dev/file-viewer-vue2.6/' not found"
      }
    },
    {
      "id": "vue2.6-full",
      "packageName": "@file-viewer/vue2.6-full",
      "github": {
        "url": "https://github.com/flyfish-dev/file-viewer-vue2.6-full",
        "branch": "main",
        "ok": true,
        "hash": "b80cc32d8095888f8d51568ef8e19d2eb3befbef",
        "error": ""
      },
      "gitee": {
        "url": "https://gitee.com/flyfish-dev/file-viewer-vue2.6-full",
        "branch": "main",
        "ok": false,
        "hash": "",
        "error": "remote: [session-id] 404 not found!\nfatal: repository 'https://gitee.com/flyfish-dev/file-viewer-vue2.6-full/' not found"
      }
    },
    {
      "id": "react",
      "packageName": "@file-viewer/react",
      "github": {
        "url": "https://github.com/flyfish-dev/file-viewer-react",
        "branch": "main",
        "ok": true,
        "hash": "6d3c5d34c151d4456e7b1ad8092f906d1a1d532d",
        "error": ""
      },
      "gitee": {
        "url": "https://gitee.com/flyfish-dev/file-viewer-react",
        "branch": "main",
        "ok": false,
        "hash": "",
        "error": "remote: [session-id] 404 not found!\nfatal: repository 'https://gitee.com/flyfish-dev/file-viewer-react/' not found"
      }
    },
    {
      "id": "react-full",
      "packageName": "@file-viewer/react-full",
      "github": {
        "url": "https://github.com/flyfish-dev/file-viewer-react-full",
        "branch": "main",
        "ok": true,
        "hash": "3aa13945f93eb1afea8d915663509d697a5e0c8f",
        "error": ""
      },
      "gitee": {
        "url": "https://gitee.com/flyfish-dev/file-viewer-react-full",
        "branch": "main",
        "ok": false,
        "hash": "",
        "error": "remote: [session-id] 404 not found!\nfatal: repository 'https://gitee.com/flyfish-dev/file-viewer-react-full/' not found"
      }
    },
    {
      "id": "react-legacy",
      "packageName": "@file-viewer/react-legacy",
      "github": {
        "url": "https://github.com/flyfish-dev/file-viewer-react-legacy",
        "branch": "main",
        "ok": true,
        "hash": "6919354b421cc436f0c3667c2a0a2a0bd00412d8",
        "error": ""
      },
      "gitee": {
        "url": "https://gitee.com/flyfish-dev/file-viewer-react-legacy",
        "branch": "main",
        "ok": false,
        "hash": "",
        "error": "remote: [session-id] 404 not found!\nfatal: repository 'https://gitee.com/flyfish-dev/file-viewer-react-legacy/' not found"
      }
    },
    {
      "id": "react-legacy-full",
      "packageName": "@file-viewer/react-legacy-full",
      "github": {
        "url": "https://github.com/flyfish-dev/file-viewer-react-legacy-full",
        "branch": "main",
        "ok": true,
        "hash": "368c4097dbc7def6d1798178c2547ba462d087cb",
        "error": ""
      },